{
  "work_id": "backend-migration",
  "source_plan": "specs/backend-migration/plan.json",
  "stages": [
    {
      "id": "STAGE-01",
      "status": "complete",
      "files_changed": [
        "server/api_characterization_test.go",
        "server/go.mod",
        "client/src/apiContract.test.js",
        "tests/contract/fixtures.json",
        "tests/contract/run.mjs",
        "tests/contract/README.md",
        "specs/backend-migration/characterization.md",
        "specs/backend-migration/implementation.json"
      ],
      "test_evidence": [
        {
          "command": "docker run --rm -v /Users/vinny/workspace/personal/feeling/server:/work -w /work golang:1.23 go test ./...",
          "result": "pass",
          "details": "Untouched pre-change Go baseline passed in the official Go 1.23 container. The host has no Go executable, so the container is the reproducible test runtime."
        },
        {
          "command": "cd client && npm test -- --watchAll=false",
          "result": "pass",
          "details": "Untouched pre-change React baseline passed: 1 suite and 1 test. It emitted the existing TitleComponent componentWillMount warning."
        },
        {
          "command": "docker run --rm -v /Users/vinny/workspace/personal/feeling/server:/work -w /work golang:1.23 go test -count=1 -v ./...",
          "result": "pass",
          "details": "Final uncached source characterization passed. It covers real JWT/JWKS middleware for missing, malformed, valid, matching, mismatched, expired, wrong-audience, and missing-subject credentials; feelings and weekly success/empty/invalid/identity/query/upsert behavior through real Gin handlers with Mongo wire mocks; and legacy CORS plus unmatched ping behavior."
        },
        {
          "command": "cd client && npm test -- --watchAll=false",
          "result": "pass",
          "details": "Final React suite passed: 2 suites and 3 tests. New tests verify current Auth0 audience, bearer and x-user-id headers, routes, query parameters, and feelings/weekly request payloads. The pre-existing TitleComponent lifecycle warning remains characterized and unchanged."
        },
        {
          "command": "node --check tests/contract/run.mjs",
          "result": "pass",
          "details": "The base-URL-driven source/target smoke runner is syntactically valid. It requires explicit CONTRACT_BASE_URL and optional isolated test credentials at execution time and embeds no credentials."
        },
        {
          "command": "python3 -m json.tool tests/contract/fixtures.json >/dev/null",
          "result": "pass",
          "details": "Runtime-neutral contract fixtures are valid JSON and contain only synthetic identities and content."
        },
        {
          "command": "python3 .ai-os/validate.py specs/backend-migration/plan.json .ai-os/schemas/plan.schema.json --ready",
          "result": "pass",
          "details": "The source plan remained structurally valid, ready, and approved while Stage 1 was implemented."
        }
      ],
      "notes": "Stage 1 changed tests, test-only module metadata, fixtures, and migration documentation only; server/main.go, server/handlers.go, and runtime React behavior were not modified. Characterized source quirks include null empty feelings, unsorted feeling reads, permissive/inconsistent validation errors, empty-200 CORS rejection, and an unmatched client ping. The replacement must follow the approved normalized design rather than copy those quirks. Repository search plus Vinicius Delascio's Define-stage confirmation provides the current evidence that the OpenClaw/chat/agent routes have no caller; no production logs, secrets, private data, or external systems were accessed."
    },
    {
      "id": "STAGE-02",
      "status": "complete",
      "files_changed": [
        ".dockerignore",
        "api/Dockerfile",
        "api/README.md",
        "api/deno.json",
        "api/deno.lock",
        "api/src/app.ts",
        "api/src/config.ts",
        "api/src/log.ts",
        "api/src/main.ts",
        "api/tests/app_test.ts",
        "api/tests/compatibility_test.ts",
        "specs/backend-migration/implementation.json"
      ],
      "test_evidence": [
        {
          "command": "docker run --rm --entrypoint /usr/bin/deno denoland/deno:debian-2.9.4 --version",
          "result": "pass",
          "details": "Pinned runtime reports Deno 2.9.4 stable, V8 15.0.245.2-rusty, and TypeScript 6.0.3. The official image resolves to denoland/deno@sha256:c777b4b225501a61074837e90a826a58f99124837824023cd60334b1e2374498."
        },
        {
          "command": "docker run --rm -v /Users/vinny/workspace/personal/feeling/api:/app -w /app denoland/deno:debian-2.9.4 task fmt:check",
          "result": "pass",
          "details": "Deno formatter checked all eight Stage 2 source, test, configuration, and documentation files with no differences."
        },
        {
          "command": "docker run --rm -v /Users/vinny/workspace/personal/feeling/api:/app -w /app denoland/deno:debian-2.9.4 task lint",
          "result": "pass",
          "details": "Deno lint checked all six TypeScript source and test files with no findings."
        },
        {
          "command": "docker run --rm -v /Users/vinny/workspace/personal/feeling/api:/app -w /app denoland/deno:debian-2.9.4 task check",
          "result": "pass",
          "details": "Frozen dependency resolution and TypeScript checking passed for src/main.ts and all tests."
        },
        {
          "command": "docker run --rm -v /Users/vinny/workspace/personal/feeling/api:/app -w /app denoland/deno:debian-2.9.4 task test",
          "result": "pass",
          "details": "Seven tests passed. They verify the health-only HTTP surface, absence of business and retired routes, strict Zod schemas, JOSE signing/verification and remote-JWKS support, lazy TLS postgres.js compatibility with prepared statements disabled, strict runtime configuration, and log field redaction."
        },
        {
          "command": "docker run --rm -v /Users/vinny/workspace/personal/feeling/api:/app:ro -w /app --entrypoint /usr/bin/deno denoland/deno:debian-2.9.4 audit",
          "result": "pass",
          "details": "Deno reported no known vulnerabilities in the lockfile. The lock contains only the three explicit zero-transitive-dependency packages: Zod 4.4.3, JOSE 6.2.9, and postgres.js 3.4.9."
        },
        {
          "command": "docker build --no-cache -f api/Dockerfile -t feeling-api:stage-2 .",
          "result": "pass",
          "details": "A clean OCI build passed from the digest-pinned official Deno image using deno ci --prod, the frozen integrity lockfile, and an in-image type check. No lifecycle scripts, node_modules directory, native addons, or unpinned base tag are required."
        },
        {
          "command": "curl --fail --silent --show-error --dump-header - http://127.0.0.1:18082/healthz",
          "result": "pass",
          "details": "The final local container returned HTTP 200, cache-control no-store, application/json, and {\"status\":\"ok\"}."
        },
        {
          "command": "docker exec feeling-api-stage2-final id",
          "result": "pass",
          "details": "The final image ran as uid/gid 1993 (deno)."
        },
        {
          "command": "docker inspect --format '{{json .Config.Cmd}}' feeling-api-stage2-final",
          "result": "pass",
          "details": "The final command uses frozen cached dependencies, no prompts, environment access only for DEPLOYMENT_VERSION/HOST/PORT, ignored ambient PG* reads, and network permission only to listen on 0.0.0.0:8080; no filesystem, subprocess, FFI, system, or broad environment permission is granted."
        },
        {
          "command": "docker stop --timeout 10 feeling-api-stage2-final",
          "result": "pass",
          "details": "SIGTERM produced sanitized server_shutdown_started and server_shutdown_complete JSON events and the ephemeral container exited cleanly. Startup and health request logs contained only allowlisted operational fields."
        },
        {
          "command": "docker build -f Dockerfile -t feeling-go:stage-2-regression .",
          "result": "pass",
          "details": "The unchanged legacy Go API and React production image still builds after adding the root .dockerignore, preserving the rollback source. Its existing npm dependency installation reported 82 audit findings (15 low, 17 moderate, 42 high, and 8 critical); Stage 2 did not alter or waive them."
        }
      ],
      "notes": "Stage 2 selects native Deno.serve rather than an HTTP framework, native Deno.test with node:assert/strict, Zod 4.4.3, JOSE 6.2.9, and postgres.js 3.4.9. Deno config-file permission sets were evaluated but not retained because Deno 2.9 still marks them experimental; stable explicit CLI permissions provide the approved least-privilege boundary. postgres.js probes conventional PG* environment names even with an explicit URL, so those reads are explicitly ignored rather than granted. The foundation exposes only GET /healthz and structured allowlisted logs. Auth0 middleware, real database connectivity, feelings, weekly tracker, Data API, Edge Functions, Storage, jobs, and operator behavior remain unimplemented. No Supabase resource, cloud infrastructure, credential, production data, environment, endpoint, or traffic was accessed or changed."
    },
    {
      "id": "STAGE-03",
      "status": "complete",
      "files_changed": [
        ".gitignore",
        "api/.env.example",
        "supabase/.gitignore",
        "supabase/config.toml",
        "specs/backend-migration/stage-03-supabase.md",
        "specs/backend-migration/implementation.json"
      ],
      "test_evidence": [
        {
          "command": "python3 .ai-os/validate.py specs/backend-migration/plan.json .ai-os/schemas/plan.schema.json --ready",
          "result": "pass",